{
  "components": [
    [
      -0.012876855,
      -0.026034648,
      -0.007778691,
      -0.000203976,
      -0.041565794,
      0.008363927,
      0.008386905,
      -0.054463389,
      -0.010421622,
      -0.0101014,
      0.017473237,
      -2.2447e-05,
      -0.062421282,
      -0.010341219,
      0.025693566,
      0.002823871,
      0.026221501,
      0.011625642,
      -0.016533186,
      -0.053577052,
      0.002403148,
      -0.022753737,
      -0.064986883,
      0.006327069,
      -0.059203208,
      -0.024239519,
      -0.005215924,
      0.012199838,
      -0.001902941,
      0.007952297,
      -0.030855528,
      0.013438955,
      0.000266284,
      0.001063418,
      -0.010271056,
      -0.036418038,
      0.004137465,
      -0.005670071,
      -0.059772978,
      -0.016699792,
      -0.017741544,
      0.030624426,
      -0.00558659,
      0.006881024,
      -0.004228639,
      -0.017219233,
      -0.042181278,
      -0.02922665,
      -0.000814845,
      -0.01470029,
      -0.022695765,
      -0.048103223,
      -0.012673881,
      -0.000687174,
      -0.012634916,
      0.019760488,
      0.01699041,
      0.031894908,
      -0.005094579,
      -0.030455543,
      -0.01256894,
      -0.015386143,
      -0.024384867,
      0.017476707,
      0.005810651,
      -0.021962629,
      -0.005135988,
      -0.01525679,
      -0.034847777,
      -0.042487801,
      0.003755158,
      0.004318727,
      0.003783502,
      -0.000850262,
      0.000623008,
      0.004802631,
      -0.016855583,
      -0.021376651,
      -0.003944638,
      -0.021697478,
      0.02079077,
      -0.05412886,
      -0.033807328,
      0.0171799,
      0.012219857,
      0.004382958,
      -0.030014961,
      0.018533364,
      0.050782267,
      -0.011068293,
      0.028302677,
      0.028472021,
      -0.027830062,
      0.019453538,
      -0.032818657,
      0.028661917,
      -0.005115564,
      -0.004933812,
      0.041438493,
      0.043763126,
      -0.044536179,
      0.007019471,
      0.006817453,
      0.002829728,
      -0.033912859,
      0.014279879,
      -0.021567797,
      0.012485459,
      0.034555918,
      -0.004174149,
      -0.035625892,
      0.057743034,
      -0.007038068,
      -0.011545075,
      0.000214488,
      -0.019452045,
      -0.009013031,
      -0.004034603,
      -0.011800809,
      0.05504388,
      -0.062807177,
      -0.022651096,
      0.007197568,
      0.004031759,
      0.018865933,
      -0.023277592,
      -0.027879125,
      0.004185031,
      -0.043988006,
      -0.006431839,
      -0.031145428,
      -0.011818676,
      0.003927863,
      0.006875955,
      -0.047113347,
      0.010529508,
      -0.009562099,
      -0.001930605,
      -0.010039533,
      -0.028719747,
      -0.008141972,
      -0.026285861,
      0.006578218,
      -0.019969532,
      0.056231739,
      -0.000707515,
      -0.038161514,
      -0.026645649,
      -0.019412114,
      -0.058304194,
      0.018818498,
      0.002199241,
      -0.044037564,
      0.012546351,
      -0.0030065,
      -0.003228156,
      -0.001902718,
      -0.006148829,
      0.007347458,
      -0.002472155,
      0.029496815,
      0.004424256,
      -0.004455382,
      -0.029153716,
      -0.030715324,
      0.016085487,
      -0.003491136,
      -0.010366561,
      0.046917199,
      0.103581922,
      -0.053872447,
      -0.003143548,
      -0.002413279,
      -0.003635027,
      -0.004478321,
      -0.039411881,
      -0.008401473,
      0.004205157,
      0.00550288,
      0.01003306,
      0.000503874,
      -0.006979261,
      -0.034102766,
      0.043751258,
      -0.009523248,
      -0.051431377,
      -0.010387458,
      -0.002801235,
      -0.037037207,
      -0.001173283,
      0.013919265,
      0.025704835,
      0.006949355,
      -0.01322594,
      -0.011145532,
      -0.013368932,
      -0.023569009,
      -0.002036994,
      0.002588885,
      -0.011493735,
      -0.009965288,
      -0.008777226,
      -0.005995066,
      -0.004813836,
      0.000285957,
      0.016410446,
      0.03367468,
      -0.002491574,
      -0.028039107,
      0.014368361,
      -0.011180461,
      -0.009070117,
      -0.001870655,
      0.016968136,
      -0.059876525,
      -0.038135331,
      0.028337657,
      -0.002044398,
      -0.000121336,
      -0.004128704,
      0.01671029,
      0.000475117,
      -0.036131514,
      0.005572169,
      0.018235706,
      0.013997301,
      -0.00364473,
      0.018997742,
      -0.013595469,
      -0.006013828,
      -0.046331847,
      -0.00959383,
      0.038621572,
      0.004980956,
      -0.021979342,
      -0.012249128,
      -0.01648354,
      0.043222176,
      -0.001280057,
      -0.030126528,
      0.052923522,
      -0.005836015,
      0.02171093,
      -0.037906682,
      -0.017447111,
      -0.007851361,
      -0.017866749,
      -0.012188071,
      -0.012001831,
      -0.034913358,
      -0.032275353,
      0.010188777,
      -3.7986e-05,
      0.058161676,
      -0.070360498,
      -0.021046347,
      -0.046247887,
      0.008885588,
      0.019918197,
      -0.020479386,
      -0.044068803,
      0.006195946,
      0.004547582,
      -0.000766642,
      0.140483977,
      -0.010343513,
      -0.017797614,
      0.028396478,
      -0.00984798,
      -0.047223075,
      0.009883377,
      0.008751203,
      -0.01814734,
      -0.019555928,
      0.045085359,
      -0.01079145,
      0.114705543,
      -0.000557851,
      0.027487141,
      -0.025794285,
      0.005033609,
      -0.00840816,
      -0.035099013,
      -0.040819756,
      -0.01940323,
      0.029134394,
      -0.029400224,
      -0.070841948,
      0.029386563,
      -8.1299e-05,
      -0.007569961,
      -0.009805544,
      0.030384392,
      0.026539692,
      0.003229573,
      -0.020566518,
      -0.010081791,
      -0.038765688,
      -0.047906418,
      0.023377499,
      0.100633022,
      -0.004493152,
      0.053008071,
      0.021552215,
      -0.001033672,
      0.018688156,
      -0.004977269,
      0.000193984,
      -0.006186433,
      -0.006246951,
      -0.018799644,
      -0.012105339,
      0.003700066,
      0.02606202,
      -0.001982141,
      0.014040706,
      -0.01190732,
      -0.009746151,
      -0.052035147,
      -0.003595151,
      -0.004068669,
      -0.030489403,
      -0.021864242,
      0.00528283,
      0.026226499,
      0.007858978,
      0.012407842,
      0.015384988,
      -0.018629011,
      0.000388365,
      -0.008578689,
      -0.013946809,
      -0.012515024,
      -0.017206648,
      -0.010972838,
      -0.046750478,
      -0.006701623,
      -0.059499421,
      -0.009921001,
      -0.003552954,
      -0.006560649,
      -0.015895616,
      0.022429683,
      -0.010986801,
      -0.002297171,
      -0.017081047,
      0.004781419,
      0.061084968,
      0.084822422,
      -0.003101071,
      0.012199662,
      -0.054061102,
      3.7305e-05,
      0.001450735,
      -0.002329641,
      0.012607848,
      0.033138469,
      0.055585518,
      0.044888538,
      -0.005990539,
      0.036231838,
      0.011844215,
      -0.012046209,
      -0.012839008,
      0.016836282,
      -0.012361799,
      -0.000863854,
      0.0356249,
      -0.033537951,
      -0.003083401,
      0.004795774,
      -0.025368213,
      0.045778072,
      0.012421145,
      0.008792856,
      -0.041131023,
      -0.011253646,
      -0.034042058,
      0.029432033,
      -0.017298158,
      0.008263468,
      -0.03901387,
      -0.023727679,
      -0.022657726,
      -0.013984829,
      -0.004603187,
      0.017932093,
      -0.061395419,
      0.005411668,
      0.03054179,
      0.00053903,
      0.010841833,
      -0.043342318,
      0.007033171,
      0.01700718,
      0.009466952,
      0.027396683,
      0.018213923,
      0.014843005,
      0.001543467,
      -0.022104655,
      0.025490104,
      -0.071039168,
      -0.012613436,
      0.032822043,
      -0.000334685,
      -0.006716056,
      -0.019592129,
      -0.018373066,
      -0.009822816,
      -0.068373109,
      0.004608132,
      -0.031744045,
      0.007422804,
      -0.012988578,
      -0.009566475,
      0.002837325,
      -0.005462547,
      -0.018961438,
      -0.004786575,
      -0.056793939,
      0.022896096,
      0.007337977,
      -0.018621851,
      -0.009215325,
      0.014053086,
      -0.012144302,
      -0.010528,
      0.00050807,
      0.022273138,
      -0.012832097,
      0.001777803,
      -0.035662946,
      0.003117002,
      0.018680988,
      0.002938331,
      -0.020736482,
      -0.008244351,
      -0.009537667,
      0.00669178,
      0.111112794,
      -0.010188361,
      -0.027455597,
      -0.012525803,
      0.007121449,
      -0.002274484,
      -0.041061733,
      0.053217585,
      0.058874099,
      -0.05363643,
      -0.075897872,
      0.004370909,
      -0.025799812,
      -0.061157843,
      0.016634409,
      0.057332906,
      -0.002840761,
      -0.00707005,
      -0.010782562,
      0.001803516,
      -0.004763065,
      -0.004985608,
      -0.041980866,
      -0.011406672,
      0.01145245,
      -0.023039646,
      0.006176694,
      0.00808481,
      -0.001599401,
      -0.008692718,
      0.005603693,
      -0.016539646,
      0.013527238,
      -0.000273449,
      -0.020059972,
      0.001115819,
      -0.003420048,
      0.009115108,
      0.080862316,
      -0.033152424,
      -0.021933237,
      0.011412911,
      0.002949651,
      0.005405042,
      -0.000578741,
      0.025302637,
      0.000645822,
      0.005945654,
      0.024194981,
      -0.037709809,
      -0.018222155,
      -0.005360472,
      -0.001549056,
      0.001982469,
      -0.005828169,
      -0.049065994,
      0.037813987,
      0.002531823,
      -0.003360498,
      0.012788984,
      0.002387576,
      -0.027108106,
      -0.004292145,
      -0.005006016,
      0.019052569,
      -0.031757577,
      -0.011469934,
      0.07878229,
      0.049163863,
      -0.008425423,
      -0.010540917,